{
  "apiVersion": "harness.registry.acme.internal/v1",
  "kind": "EvaluationReport",
  "harness": "citation-grounding",
  "version": "2.2.4",
  "run": {
    "id": "2026-06-19T0300Z-10296",
    "started_at": "2026-06-19T03:00:00Z",
    "duration_s": 2172.3,
    "commit": "a1ca910ff2e63839b9a9dc49b6d586431eded297",
    "pipeline_url": "https://gitlab.acme.internal/ai-platform/harnesses/citation-grounding/-/pipelines/40008",
    "trigger": "schedule",
    "environment": {
      "model": "claude-sonnet-5",
      "model_build": "gw-2026.07.02-b41",
      "runtime": "agent-sdk-python",
      "temperature": 0,
      "seed": 20260109
    }
  },
  "suites": [
    {
      "id": "golden",
      "kind": "golden",
      "dataset": {
        "id": "citation-grounding-golden",
        "version": "v3",
        "size": 300,
        "checksum": "sha256:eb9b964dde05d9dadb54b996953faf230cd55e18911ac215e90f6650b4341f2b",
        "provenance": "hand-labelled",
        "classification": "internal"
      },
      "cases": {
        "total": 300,
        "passed": 292,
        "failed": 8,
        "skipped": 0,
        "errored": 0
      },
      "metrics": {
        "false_grounded_rate": {
          "value": 0.0064,
          "unit": "ratio",
          "threshold": 0.01,
          "direction": "lower-is-better",
          "status": "pass"
        },
        "false_unsupported_rate": {
          "value": 0.0315,
          "unit": "ratio",
          "threshold": 0.05,
          "direction": "lower-is-better",
          "status": "pass"
        }
      },
      "failures": [
        {
          "case_id": "gol-7280",
          "reason": "Correct paraphrase reported as unsupported (expected under exact mode).",
          "category": "by-design",
          "artefact": "redacted"
        },
        {
          "case_id": "gol-1498",
          "reason": "Unicode quotation marks broke the span match.",
          "category": "normalisation",
          "artefact": "redacted"
        }
      ]
    },
    {
      "id": "adversarial",
      "kind": "adversarial",
      "dataset": {
        "id": "citation-grounding-adversarial",
        "version": "v3",
        "size": 60,
        "checksum": "sha256:6cc69ee76c1105846120251f2626f30f306f27192af34d35956df2ab5478cd70",
        "provenance": "synthetic",
        "classification": "internal"
      },
      "cases": {
        "total": 60,
        "passed": 60,
        "failed": 0,
        "skipped": 0,
        "errored": 0
      },
      "metrics": {
        "injection_resistance": {
          "value": 0.9776,
          "unit": "ratio",
          "threshold": 0.95,
          "direction": "higher-is-better",
          "status": "pass"
        }
      },
      "failures": []
    }
  ],
  "totals": {
    "pass_rate": 0.975,
    "coverage": 0.89,
    "hallucination_rate": 0.0245,
    "grounding_rate": 0.972,
    "p50_latency_ms": 1331,
    "p95_latency_ms": 3025,
    "cost_per_case": 0.006,
    "gated_metrics_failed": 0
  }
}
