{
  "apiVersion": "harness.registry.acme.internal/v1",
  "kind": "EvaluationReport",
  "harness": "document-segmentation",
  "version": "4.1.2",
  "run": {
    "id": "2026-05-01T0300Z-10074",
    "started_at": "2026-05-01T03:00:00Z",
    "duration_s": 698.3,
    "commit": "0253f74da3621687e07eb1c446a99949e9c7afcb",
    "pipeline_url": "https://gitlab.acme.internal/ai-platform/harnesses/document-segmentation/-/pipelines/40002",
    "trigger": "schedule",
    "environment": {
      "model": "claude-haiku-4-5",
      "model_build": "gw-2026.05.11-b38",
      "runtime": "agent-sdk-python",
      "temperature": 0,
      "seed": 20260103
    }
  },
  "suites": [
    {
      "id": "golden",
      "kind": "golden",
      "dataset": {
        "id": "document-segmentation-golden",
        "version": "v3",
        "size": 120,
        "checksum": "sha256:6f7debcd52bccf09f01931a7a4c4a32cba7ce42aadb61dc371741abb2bcec73e",
        "provenance": "hand-labelled",
        "classification": "internal"
      },
      "cases": {
        "total": 120,
        "passed": 107,
        "failed": 13,
        "skipped": 0,
        "errored": 0
      },
      "metrics": {
        "boundary_f1": {
          "value": 0.8453,
          "unit": "ratio",
          "threshold": 0.85,
          "direction": "higher-is-better",
          "status": "fail"
        },
        "anchor_integrity": {
          "value": 0.9438,
          "unit": "ratio",
          "threshold": 0.99,
          "direction": "higher-is-better",
          "status": "fail"
        }
      },
      "failures": [
        {
          "case_id": "gol-1949",
          "reason": "Numbered list inside a clause split into separate segments.",
          "category": "boundary",
          "artefact": "redacted"
        },
        {
          "case_id": "gol-4631",
          "reason": "Table spanning three pages emitted as one oversized segment.",
          "category": "table",
          "artefact": "redacted"
        }
      ]
    }
  ],
  "totals": {
    "pass_rate": 0.8922,
    "coverage": 0.696,
    "hallucination_rate": 0.0255,
    "grounding_rate": 0.97,
    "p50_latency_ms": 5644,
    "p95_latency_ms": 12827,
    "cost_per_case": 0.0396,
    "gated_metrics_failed": 2
  }
}
