{
  "apiVersion": "harness.registry.acme.internal/v1",
  "kind": "EvaluationReport",
  "harness": "sql-analyst",
  "version": "0.9.2",
  "run": {
    "id": "2026-04-21T0300Z-10074",
    "started_at": "2026-04-21T03:00:00Z",
    "duration_s": 895.0,
    "commit": "46eedc190bd26b3dc67fd96066c689028cd30223",
    "pipeline_url": "https://gitlab.acme.internal/ai-platform/harnesses/sql-analyst/-/pipelines/40002",
    "trigger": "schedule",
    "environment": {
      "model": "claude-opus-5",
      "model_build": "gw-2026.05.11-b38",
      "runtime": "agent-sdk-python",
      "temperature": 0,
      "seed": 20260103
    }
  },
  "suites": [
    {
      "id": "golden",
      "kind": "golden",
      "dataset": {
        "id": "sql-analyst-golden",
        "version": "v3",
        "size": 42,
        "checksum": "sha256:7d675a2b41f95c30cc674684dfbf131ea97844012304ff5d90601ecc08443b44",
        "provenance": "hand-labelled",
        "classification": "internal"
      },
      "cases": {
        "total": 42,
        "passed": 33,
        "failed": 9,
        "skipped": 0,
        "errored": 0
      },
      "metrics": {
        "execution_accuracy": {
          "value": 0.7779,
          "unit": "ratio",
          "threshold": 0.85,
          "direction": "higher-is-better",
          "status": "fail"
        },
        "result_exact_match": {
          "value": 0.6868,
          "unit": "ratio",
          "threshold": 0.8,
          "direction": "higher-is-better",
          "status": "fail"
        }
      },
      "failures": [
        {
          "case_id": "gol-3296",
          "reason": "Question implied a metric not defined in the semantic layer.",
          "category": "semantic-gap",
          "artefact": "redacted"
        },
        {
          "case_id": "gol-4834",
          "reason": "Correct SQL, wrong interpretation of 'last quarter' (fiscal vs calendar).",
          "category": "interpretation",
          "artefact": "redacted"
        }
      ]
    }
  ],
  "totals": {
    "pass_rate": 0.7738,
    "coverage": 0.516,
    "hallucination_rate": 0.0128,
    "grounding_rate": 0.98,
    "p50_latency_ms": 14063,
    "p95_latency_ms": 31962,
    "cost_per_case": 0.0876,
    "gated_metrics_failed": 2
  }
}
